{
  "$schema": "https://json-schema.org/draft/2020-12/schema",
  "type": "object",
  "properties": {
    "schemaVersion": {
      "type": "number",
      "const": 1
    },
    "type": {
      "type": "string",
      "const": "slide"
    },
    "canvas": {
      "default": {
        "width": 1920,
        "height": 1080
      },
      "type": "object",
      "properties": {
        "width": {
          "type": "number",
          "const": 1920
        },
        "height": {
          "type": "number",
          "const": 1080
        }
      },
      "required": [
        "width",
        "height"
      ]
    },
    "theme": {
      "default": "dark",
      "type": "string",
      "minLength": 1
    },
    "background": {
      "oneOf": [
        {
          "type": "object",
          "properties": {
            "kind": {
              "type": "string",
              "const": "flat"
            },
            "color": {
              "type": "string",
              "pattern": "^#[0-9a-fA-F]{6}([0-9a-fA-F]{2})?$"
            }
          },
          "required": [
            "kind",
            "color"
          ]
        },
        {
          "type": "object",
          "properties": {
            "kind": {
              "type": "string",
              "const": "gradient"
            },
            "from": {
              "type": "string",
              "pattern": "^#[0-9a-fA-F]{6}([0-9a-fA-F]{2})?$"
            },
            "to": {
              "type": "string",
              "pattern": "^#[0-9a-fA-F]{6}([0-9a-fA-F]{2})?$"
            },
            "angle": {
              "type": "number"
            }
          },
          "required": [
            "kind",
            "from",
            "to",
            "angle"
          ]
        }
      ]
    },
    "elements": {
      "default": [],
      "type": "array",
      "items": {
        "oneOf": [
          {
            "type": "object",
            "properties": {
              "id": {
                "type": "string",
                "minLength": 1
              },
              "x": {
                "type": "number"
              },
              "y": {
                "type": "number"
              },
              "width": {
                "type": "number",
                "exclusiveMinimum": 0
              },
              "height": {
                "type": "number",
                "exclusiveMinimum": 0
              },
              "rotation": {
                "default": 0,
                "type": "number"
              },
              "visible": {
                "default": true,
                "type": "boolean"
              },
              "locked": {
                "default": false,
                "type": "boolean"
              },
              "name": {
                "type": "string"
              },
              "groupId": {
                "type": "string"
              },
              "type": {
                "type": "string",
                "const": "text"
              },
              "variant": {
                "type": "string",
                "enum": [
                  "eyebrow",
                  "title",
                  "body",
                  "bullets"
                ]
              },
              "text": {
                "type": "string"
              },
              "style": {
                "default": {},
                "type": "object",
                "properties": {
                  "fontFamily": {
                    "type": "string"
                  },
                  "fontSize": {
                    "type": "number",
                    "exclusiveMinimum": 0
                  },
                  "fontWeight": {
                    "type": "integer",
                    "minimum": 100,
                    "maximum": 900
                  },
                  "color": {
                    "type": "string",
                    "pattern": "^#[0-9a-fA-F]{6}([0-9a-fA-F]{2})?$"
                  },
                  "align": {
                    "type": "string",
                    "enum": [
                      "left",
                      "center",
                      "right"
                    ]
                  },
                  "lineHeight": {
                    "type": "number",
                    "exclusiveMinimum": 0
                  }
                }
              }
            },
            "required": [
              "id",
              "x",
              "y",
              "width",
              "height",
              "type",
              "variant",
              "text"
            ]
          },
          {
            "type": "object",
            "properties": {
              "id": {
                "type": "string",
                "minLength": 1
              },
              "x": {
                "type": "number"
              },
              "y": {
                "type": "number"
              },
              "width": {
                "type": "number",
                "exclusiveMinimum": 0
              },
              "height": {
                "type": "number",
                "exclusiveMinimum": 0
              },
              "rotation": {
                "default": 0,
                "type": "number"
              },
              "visible": {
                "default": true,
                "type": "boolean"
              },
              "locked": {
                "default": false,
                "type": "boolean"
              },
              "name": {
                "type": "string"
              },
              "groupId": {
                "type": "string"
              },
              "type": {
                "type": "string",
                "enum": [
                  "rect",
                  "ellipse"
                ]
              },
              "style": {
                "default": {},
                "type": "object",
                "properties": {
                  "fill": {
                    "type": "string",
                    "pattern": "^#[0-9a-fA-F]{6}([0-9a-fA-F]{2})?$"
                  },
                  "stroke": {
                    "type": "string",
                    "pattern": "^#[0-9a-fA-F]{6}([0-9a-fA-F]{2})?$"
                  },
                  "strokeWidth": {
                    "type": "number",
                    "minimum": 0
                  },
                  "cornerRadius": {
                    "type": "number",
                    "minimum": 0
                  }
                }
              }
            },
            "required": [
              "id",
              "x",
              "y",
              "width",
              "height",
              "type"
            ]
          },
          {
            "type": "object",
            "properties": {
              "id": {
                "type": "string",
                "minLength": 1
              },
              "x": {
                "type": "number"
              },
              "y": {
                "type": "number"
              },
              "width": {
                "type": "number",
                "exclusiveMinimum": 0
              },
              "height": {
                "type": "number",
                "exclusiveMinimum": 0
              },
              "rotation": {
                "default": 0,
                "type": "number"
              },
              "visible": {
                "default": true,
                "type": "boolean"
              },
              "locked": {
                "default": false,
                "type": "boolean"
              },
              "name": {
                "type": "string"
              },
              "groupId": {
                "type": "string"
              },
              "type": {
                "type": "string",
                "enum": [
                  "line",
                  "arrow"
                ]
              },
              "style": {
                "default": {},
                "type": "object",
                "properties": {
                  "fill": {
                    "type": "string",
                    "pattern": "^#[0-9a-fA-F]{6}([0-9a-fA-F]{2})?$"
                  },
                  "stroke": {
                    "type": "string",
                    "pattern": "^#[0-9a-fA-F]{6}([0-9a-fA-F]{2})?$"
                  },
                  "strokeWidth": {
                    "type": "number",
                    "minimum": 0
                  },
                  "cornerRadius": {
                    "type": "number",
                    "minimum": 0
                  }
                }
              }
            },
            "required": [
              "id",
              "x",
              "y",
              "width",
              "height",
              "type"
            ]
          },
          {
            "type": "object",
            "properties": {
              "id": {
                "type": "string",
                "minLength": 1
              },
              "x": {
                "type": "number"
              },
              "y": {
                "type": "number"
              },
              "width": {
                "type": "number",
                "exclusiveMinimum": 0
              },
              "height": {
                "type": "number",
                "exclusiveMinimum": 0
              },
              "rotation": {
                "default": 0,
                "type": "number"
              },
              "visible": {
                "default": true,
                "type": "boolean"
              },
              "locked": {
                "default": false,
                "type": "boolean"
              },
              "name": {
                "type": "string"
              },
              "groupId": {
                "type": "string"
              },
              "type": {
                "type": "string",
                "const": "image"
              },
              "src": {
                "type": "string"
              },
              "alt": {
                "default": "",
                "type": "string"
              },
              "fit": {
                "default": "cover",
                "type": "string",
                "enum": [
                  "cover",
                  "contain"
                ]
              }
            },
            "required": [
              "id",
              "x",
              "y",
              "width",
              "height",
              "type",
              "src"
            ]
          },
          {
            "type": "object",
            "properties": {
              "id": {
                "type": "string",
                "minLength": 1
              },
              "x": {
                "type": "number"
              },
              "y": {
                "type": "number"
              },
              "width": {
                "type": "number",
                "exclusiveMinimum": 0
              },
              "height": {
                "type": "number",
                "exclusiveMinimum": 0
              },
              "rotation": {
                "default": 0,
                "type": "number"
              },
              "visible": {
                "default": true,
                "type": "boolean"
              },
              "locked": {
                "default": false,
                "type": "boolean"
              },
              "name": {
                "type": "string"
              },
              "groupId": {
                "type": "string"
              },
              "type": {
                "type": "string",
                "const": "diagram"
              },
              "labels": {
                "type": "array",
                "items": {
                  "type": "string"
                }
              },
              "style": {
                "default": {},
                "type": "object",
                "properties": {
                  "fill": {
                    "type": "string",
                    "pattern": "^#[0-9a-fA-F]{6}([0-9a-fA-F]{2})?$"
                  },
                  "stroke": {
                    "type": "string",
                    "pattern": "^#[0-9a-fA-F]{6}([0-9a-fA-F]{2})?$"
                  },
                  "strokeWidth": {
                    "type": "number",
                    "minimum": 0
                  },
                  "cornerRadius": {
                    "type": "number",
                    "minimum": 0
                  }
                }
              }
            },
            "required": [
              "id",
              "x",
              "y",
              "width",
              "height",
              "type",
              "labels"
            ]
          },
          {
            "type": "object",
            "properties": {
              "id": {
                "type": "string",
                "minLength": 1
              },
              "x": {
                "type": "number"
              },
              "y": {
                "type": "number"
              },
              "width": {
                "type": "number",
                "exclusiveMinimum": 0
              },
              "height": {
                "type": "number",
                "exclusiveMinimum": 0
              },
              "rotation": {
                "default": 0,
                "type": "number"
              },
              "visible": {
                "default": true,
                "type": "boolean"
              },
              "locked": {
                "default": false,
                "type": "boolean"
              },
              "name": {
                "type": "string"
              },
              "groupId": {
                "type": "string"
              },
              "type": {
                "type": "string",
                "const": "chart"
              },
              "chartType": {
                "type": "string",
                "enum": [
                  "line",
                  "bar",
                  "pie"
                ]
              },
              "data": {
                "type": "object",
                "properties": {
                  "labels": {
                    "type": "array",
                    "items": {
                      "type": "string"
                    }
                  },
                  "series": {
                    "minItems": 1,
                    "type": "array",
                    "items": {
                      "type": "object",
                      "properties": {
                        "name": {
                          "type": "string"
                        },
                        "values": {
                          "type": "array",
                          "items": {
                            "type": "number"
                          }
                        },
                        "color": {
                          "type": "string",
                          "pattern": "^#[0-9a-fA-F]{6}([0-9a-fA-F]{2})?$"
                        }
                      },
                      "required": [
                        "name",
                        "values"
                      ]
                    }
                  }
                },
                "required": [
                  "labels",
                  "series"
                ]
              },
              "options": {
                "default": {},
                "type": "object",
                "properties": {
                  "title": {
                    "type": "string"
                  },
                  "showLegend": {
                    "default": true,
                    "type": "boolean"
                  },
                  "showGrid": {
                    "default": true,
                    "type": "boolean"
                  },
                  "showValues": {
                    "default": false,
                    "type": "boolean"
                  },
                  "yMin": {
                    "type": "number"
                  },
                  "yMax": {
                    "type": "number"
                  }
                }
              }
            },
            "required": [
              "id",
              "x",
              "y",
              "width",
              "height",
              "type",
              "chartType",
              "data"
            ]
          }
        ]
      }
    }
  },
  "required": [
    "schemaVersion",
    "type"
  ]
}
